{
  "schemaVersion": "1.0.0",
  "id": "art_0123456789abcdef0123456789abcdef",
  "provider": "provider:native:artifact:filesystem",
  "workspaceId": "ws_local",
  "kind": "artifact",
  "hashAlgorithm": "sha256",
  "contentHash": "0967115f2813a3541eaef77de9d9d5773f1c0c04314b0bbfe4ff3b3b1c55b5d5",
  "hash": "0967115f2813a3541eaef77de9d9d5773f1c0c04314b0bbfe4ff3b3b1c55b5d5",
  "byteSize": 4,
  "size": 4,
  "mediaType": "text/plain",
  "filename": "same.txt",
  "dataClass": "workspace-private",
  "retention": {
    "mode": "workspace-default"
  },
  "source": "generated",
  "createdAt": "2026-06-19T10:00:00.000Z",
  "metadata": {
    "purpose": "compatibility fixture"
  }
}
